{
  "$schema": "http://json-schema.org/draft-07/schema#",
  "title": "StyleDefinition",
  "description": "Определение стиля интерьера с пороговыми значениями для оценки соответствия",
  "type": "object",
  "required": [
    "id",
    "name",
    "description",
    "targetVector"
  ],
  "properties": {
    "id": {
      "type": "string",
      "description": "Уникальный идентификатор стиля",
      "pattern": "^[a-z0-9-]+$"
    },
    "name": {
      "type": "string",
      "description": "Название стиля"
    },
    "description": {
      "type": "string",
      "description": "Краткое описание стиля для игрока"
    },
    "targetVector": {
      "type": "object",
      "description": "Целевой вектор признаков идеальной комнаты в этом стиле",
      "required": [
        "wood_share",
        "metal_share",
        "glass_share",
        "plastic_share",
        "fabric_share",
        "color_temperature",
        "saturation",
        "form_complexity"
      ],
      "properties": {
        "wood_share": {
          "type": "number",
          "minimum": 0,
          "maximum": 1
        },
        "metal_share": {
          "type": "number",
          "minimum": 0,
          "maximum": 1
        },
        "glass_share": {
          "type": "number",
          "minimum": 0,
          "maximum": 1
        },
        "plastic_share": {
          "type": "number",
          "minimum": 0,
          "maximum": 1
        },
        "fabric_share": {
          "type": "number",
          "minimum": 0,
          "maximum": 1
        },
        "color_temperature": {
          "type": "number",
          "minimum": 0,
          "maximum": 1
        },
        "saturation": {
          "type": "number",
          "minimum": 0,
          "maximum": 1
        },
        "form_complexity": {
          "type": "number",
          "minimum": 0,
          "maximum": 1
        }
      },
      "additionalProperties": false
    }
  },
  "additionalProperties": false
}
